,accession,name,class,seq_len,is_mongrel,have_contig,complete,shotgun,chromosome
650,NC_023780,"Ratufa bicolor mitochondrion, complete genome",Mammalia,16563,False,False,True,False,False
651,NC_001788,"Equus asinus mitochondrion, complete genome",Mammalia,16670,False,False,True,False,False
652,NC_019801,"Callicebus donacophilus mitochondrion, complete genome",Mammalia,16563,False,False,True,False,False
653,NC_003321,"Tachyglossus aculeatus mitochondrion, complete genome",Mammalia,16360,False,False,True,False,False
654,NC_022421,"Brachyphylla cavernarum mitochondrion, complete genome",Mammalia,16785,False,False,True,False,False
655,NC_004023,"Arctocephalus forsteri mitochondrion, complete genome",Mammalia,15413,False,False,True,False,False
656,NC_033353,"Pteronotus personatus mitochondrion, complete genome",Mammalia,16570,False,False,True,False,False
657,NC_021960,"Saguinus oedipus mitochondrion, complete genome",Mammalia,16551,False,False,True,False,False
658,NC_011821,"Hydropotes inermis mitochondrion, complete genome",Mammalia,16355,False,False,True,False,False
659,NC_034738,"Lepilemur hollandorum isolate NARA8.5 mitochondrion, complete genome",Mammalia,17018,False,False,True,False,False
660,NC_036680,"Mus pahari mitochondrion, complete genome",Mammalia,16286,False,False,True,False,False
661,NC_008450,"Neofelis nebulosa mitochondrion, complete genome",Mammalia,16844,False,False,True,False,False
662,NC_006295,"Bubalus carabanensis mitochondrion, complete genome",Mammalia,16359,False,False,True,False,False
663,NC_005943,"Macaca mulatta mitochondrion, complete genome",Mammalia,16564,False,False,True,False,False
664,NC_012920,"Homo sapiens mitochondrion, complete genome",Mammalia,16569,False,False,True,False,False
665,NC_019581,"Trachypithecus shortridgei mitochondrion, complete genome",Mammalia,16529,False,False,True,False,False
666,NC_013571,"Eothenomys chinensis mitochondrion, complete genome",Mammalia,16362,False,False,True,False,False
667,NC_035572,"Sigmodon hispidus mitochondrion, complete genome",Mammalia,16394,False,False,True,False,False
668,NC_009969,"Tremarctos ornatus mitochondrion, complete genome",Mammalia,16766,False,False,True,False,False
669,NC_006516,"Metachirus nudicaudatus mitochondrion, complete genome",Mammalia,15882,False,False,True,False,False
670,NC_019617,"Niviventer excelsior mitochondrion, complete genome",Mammalia,16298,False,False,True,False,False
671,NC_018595,"Cervus nippon sichuanicus mitochondrion, complete genome",Mammalia,16429,False,False,True,False,False
672,NC_005436,"Pipistrellus abramus mitochondrion, complete genome",Mammalia,16976,False,False,True,False,False
673,NC_020009,"Papio papio mitochondrion, complete genome",Mammalia,16505,False,False,True,False,False
674,NC_037138,"Diphylla ecaudata voucher American Museum of Natural History, AMNH-M-261777 mitochondrion, complete genome",Mammalia,16618,False,False,True,False,False
675,NC_014867,"Rattus fuscipes mitochondrion, complete genome",Mammalia,16301,False,False,True,False,False
676,NC_060494,"Manis pentadactyla pentadactyla isolate MT27 mitochondrion, complete genome",Mammalia,16570,False,False,True,False,False
677,NC_016427,"Myodes regulus mitochondrion, complete genome",Mammalia,16379,False,False,True,False,False
678,NC_053799,"Lemniscomys rosalia voucher USB_MOZ004 mitochondrion, complete genome",Mammalia,16254,False,False,True,False,False
679,NC_005829,"Rhyncholestes raphanurus mitochondrion, complete genome",Mammalia,16727,False,False,True,False,False
680,CM027722,"Equus asinus breed Dezhou mitochondrion, whole genome shotgun sequence",Mammalia,16680,False,True,False,True,False
681,CM025140,"Canis lupus familiaris isolate SID07034 breed Labrador retriever mitochondrion, complete sequence, whole genome shotgun sequence",Mammalia,16729,False,True,True,True,False
682,NC_021958,"Nycticebus bengalensis mitochondrion, complete genome",Mammalia,16735,False,False,True,False,False
683,NC_025586,"Callithrix jacchus mitochondrion, complete genome",Mammalia,16499,False,False,True,False,False
684,CM003502,"Homo sapiens isolate CHM1 mitochondrion, complete sequence, whole genome shotgun sequence",Mammalia,16569,False,True,True,True,False
685,NC_009747,"Chlorocebus pygerythrus mitochondrion, complete genome",Mammalia,16343,False,False,True,False,False
686,NC_035609,"Phaner parienti isolate TAFO6.11 mitochondrion, complete genome",Mammalia,16626,False,False,True,False,False
687,NC_034795,"Trachypithecus poliocephalus mitochondrion, complete genome",Mammalia,16556,False,False,True,False,False
688,NC_028299,"Profelis aurata isolate PAU mitochondrion, complete genome",Mammalia,16826,False,False,True,False,False
689,NC_003322,"Vombatus ursinus mitochondrion, complete genome",Mammalia,16996,False,False,True,False,False
690,NC_030179,"Capricornis sp. YZ-2016 mitochondrion, complete genome",Mammalia,16441,False,False,True,False,False
691,NC_020732,"Oryx leucoryx isolate Saudi mitochondrion, complete genome",Mammalia,16680,False,False,True,False,False
692,NC_009970,"Melursus ursinus mitochondrion, complete genome",Mammalia,16817,False,False,True,False,False
693,NC_022423,"Desmodus rotundus mitochondrion, complete genome",Mammalia,16659,False,False,True,False,False
694,NC_037133,"Diaemus youngi voucher Museum of Southwestern Biology:MSB-56205 mitochondrion, complete genome",Mammalia,16628,False,False,True,False,False
695,NC_052873,"Ochotona coreana mitochondrion, complete genome",Mammalia,17283,False,False,True,False,False
696,CM024465,"Bos gaurus isolate Gaur_Henry_Doorly_Zoo_5443 mitochondrion, complete sequence, whole genome shotgun sequence",Mammalia,16346,False,True,True,True,False
697,NC_026124,"Rhizomys sinensis mitochondrion, complete genome",Mammalia,16564,False,False,True,False,False
698,NC_021381,"Naemorhedus goral mitochondrion, complete genome",Mammalia,16555,False,False,True,False,False
699,NC_030072,"Exilisciurus exilis voucher ROM102254 mitochondrion, complete genome",Mammalia,16337,False,False,True,False,False
700,NC_006914,"Mus musculus domesticus mitochondrion, complete genome",Mammalia,16300,False,False,True,False,False
701,NC_008447,"Lagostrophus fasciatus mitochondrion, complete genome",Mammalia,16866,False,False,True,False,False
702,NC_008066,"Chlorocebus sabaeus mitochondrion, complete genome",Mammalia,16550,False,False,True,False,False
703,NC_050011,"Sciurus arizonensis voucher MSB157846 mitochondrion, complete genome",Mammalia,16519,False,False,True,False,False
704,NC_023543,"Damaliscus lunatus mitochondrion, complete genome",Mammalia,16419,False,False,True,False,False
705,NC_020742,"Redunca fulvorufula isolate PhC12 mitochondrion, complete genome",Mammalia,16434,False,False,True,False,False
706,NC_023922,"Petaurista alborufus mitochondrion, complete genome",Mammalia,16507,False,False,True,False,False
707,NC_026064,"Ovis vignei breed Urial mitochondrion, complete genome",Mammalia,16697,False,False,True,False,False
708,NC_033902,"Petaurista yunanensis mitochondrion, complete genome",Mammalia,16620,False,False,True,False,False
709,NC_049871,"Myotis septentrionalis mitochondrion, complete genome",Mammalia,17150,False,False,True,False,False
710,NC_012346,"Bison bison mitochondrion, complete genome",Mammalia,16319,False,False,True,False,False
711,NC_062360,"Hippotragus niger variani haplogroup Central 2 mitochondrion, complete genome",Mammalia,16507,False,False,True,False,False
712,CM003309,"Homo sapiens isolate CHM13 mitochondrion, complete sequence, whole genome shotgun sequence",Mammalia,16569,False,True,True,True,False
713,CM003574,"Homo sapiens isolate CHM1 mitochondrion, complete sequence, whole genome shotgun sequence",Mammalia,16569,False,True,True,True,False
714,NC_037888,"Cricetus cricetus mitochondrion, complete genome",Mammalia,16263,False,False,True,False,False
715,NC_025316,"Lepus sinensis mitochondrion, complete genome",Mammalia,17438,False,False,True,False,False
716,NC_020670,"Crocuta crocuta isolate CC8 mitochondrion, complete genome",Mammalia,17138,False,False,True,False,False
717,NC_053858,"Chodsigoa parva mitochondrion, complete genome",Mammalia,17216,False,False,True,False,False
718,NC_049119,"Maxomys whiteheadi voucher CBGP1999514 mitochondrion, complete genome",Mammalia,16275,False,False,True,False,False
719,NC_029876,"Dactylomys dactylinus voucher UFES:UFROM-339 mitochondrion, complete genome",Mammalia,16650,False,False,True,False,False
720,NC_019590,"Orcaella brevirostris mitochondrion, complete genome",Mammalia,16383,False,False,True,False,False
721,NC_029325,"Tamiops maritimus mitochondrion, complete genome",Mammalia,16523,False,False,True,False,False
722,NC_020688,"Cephalophus jentinki isolate SUN mitochondrion, complete genome",Mammalia,16425,False,False,True,False,False
723,NC_034330,"Mustela itatsi isolate IT01 mitochondrion, complete genome",Mammalia,16027,False,False,True,False,False
724,NC_015889,"Ovis canadensis mitochondrion, complete genome",Mammalia,16463,False,False,True,False,False
725,NC_035597,"Reithrodontomys mexicanus mitochondrion, complete genome",Mammalia,16606,False,False,True,False,False
726,NC_020735,"Philantomba maxwellii isolate E11-9 mitochondrion, complete genome",Mammalia,16440,False,False,True,False,False
727,NC_026992,"Sus barbatus mitochondrion, complete genome",Mammalia,16480,False,False,True,False,False
728,NC_045404,"Sousa teuszii voucher USNM 605133 mitochondrion, complete genome",Mammalia,16384,False,False,True,False,False
729,LR822069,"Sciurus carolinensis genome assembly, organelle: mitochondrion",Mammalia,16533,False,False,False,False,False
730,NC_025278,"Sorex cylindricauda mitochondrion, complete genome",Mammalia,17191,False,False,True,False,False
731,NC_034808,"Sorex roboratus mitochondrion, complete genome",Mammalia,17153,False,False,True,False,False
732,NC_053813,"Thamnomys kempi voucher FMNH_157799 mitochondrion, complete genome",Mammalia,16270,False,False,True,False,False
733,NC_016055,"Neodon irene mitochondrion, complete genome",Mammalia,16367,False,False,True,False,False
734,NC_027963,"Sorex araneus mitochondrion, complete genome",Mammalia,16887,False,False,True,False,False
735,NC_028577,"Zaedyus pichiy voucher ISEM_T-6060 mitochondrion, complete genome",Mammalia,16598,False,False,True,False,False
736,NC_033347,"Vespertilio murinus mitochondrion, complete genome",Mammalia,16721,False,False,True,False,False
737,NC_020754,"Nannospalax galili isolate 575 mitochondrion, complete genome",Mammalia,16409,False,False,True,False,False
738,NC_039551,"Proechimys trinitatis voucher MCZ:BANGS-7778 mitochondrion, complete genome",Mammalia,16632,False,False,True,False,False
739,NC_044769,"Lepus arcticus mitochondrion, complete genome",Mammalia,17109,False,False,True,False,False
740,NC_028574,"Tamandua mexicana voucher MVZ_192699 mitochondrion, complete genome",Mammalia,16385,False,False,True,False,False
741,NC_020630,"Oreamnos americanus mitochondrion, complete genome",Mammalia,16604,False,False,True,False,False
742,NC_010497,"Spilogale putorius mitochondrion, complete genome",Mammalia,16597,False,False,True,False,False
743,NC_023368,"Pteronotus parnellii mitochondrion, complete genome",Mammalia,16564,False,False,True,False,False
744,NC_006924,"Choloepus didactylus mitochondrion, complete genome",Mammalia,16543,False,False,True,False,False
745,NC_018115,"Aotus azarai azarai mitochondrion, complete genome",Mammalia,16585,False,False,True,False,False
746,NC_035560,"Microcebus tavaratra isolate CAR5.3 mitochondrion, complete genome",Mammalia,16646,False,False,True,False,False
747,NC_008423,"Lobodon carcinophaga mitochondrion, complete genome",Mammalia,16759,False,False,True,False,False
748,NC_011124,"Ailurus fulgens mitochondrion, complete genome",Mammalia,16493,False,False,True,False,False
749,NC_023100,"Homo heidelbergensis mitochondrion, complete genome",Mammalia,16568,False,False,True,False,False
750,NC_020684,"Capreolus capreolus isolate CYTO mitochondrion, complete genome",Mammalia,16358,False,False,True,False,False
751,NC_035595,"Podomys floridanus mitochondrion, complete genome",Mammalia,16486,False,False,True,False,False
752,NC_035503,"Neodon sikimensis mitochondrion, complete genome",Mammalia,16330,False,False,True,False,False
753,NC_042762,"Crocidura fuliginosa mitochondrion, complete genome",Mammalia,16967,False,False,True,False,False
754,NC_006901,"Colobus guereza mitochondrion, complete genome",Mammalia,16648,False,False,True,False,False
755,NC_034726,"Lepilemur betsileo isolate FAN6.1 mitochondrion, complete genome",Mammalia,16916,False,False,True,False,False
756,NC_028322,"Leopardus jacobita isolate OJA mitochondrion, complete genome",Mammalia,16610,False,False,True,False,False
757,NC_046910,"Epomops buettikoferi isolate G09X3 mitochondrion, complete genome",Mammalia,16867,False,False,True,False,False
758,NC_035631,"Allocebus trichotis isolate TVY7.23 mitochondrion, complete genome",Mammalia,16863,False,False,True,False,False
759,NC_039669,"Eudorcas thomsonii mitochondrion, complete genome",Mammalia,16761,False,False,True,False,False
760,NC_031835,"Rusa unicolor mitochondrion, complete genome",Mammalia,16437,False,False,True,False,False
761,NC_034719,"Lepilemur leucopus isolate AND65 mitochondrion, complete genome",Mammalia,16753,False,False,True,False,False
762,NC_053809,"Hybomys planifrons voucher MNHN-ZM-2017-1704 mitochondrion, complete genome",Mammalia,16253,False,False,True,False,False
763,NC_046949,"Cavia aperea mitochondrion, complete genome",Mammalia,16681,False,False,True,False,False
764,NC_021941,"Callithrix geoffroyi mitochondrion, complete genome",Mammalia,16502,False,False,True,False,False
765,NC_020738,"Procapra gutturosa isolate ED mitochondrion, complete genome",Mammalia,16546,False,False,True,False,False
766,CM018178,"Phocoena sinus isolate mPhoSin1 mitochondrion, complete sequence, whole genome shotgun sequence",Mammalia,16370,False,True,True,True,False
767,NC_050014,"Sciurus nayaritensis voucher MSB47449 mitochondrion, complete genome",Mammalia,16521,False,False,True,False,False
768,NC_050682,"Callithrix aurita mitochondrion, complete genome",Mammalia,16471,False,False,True,False,False
769,NC_042753,"Nothrotheriops shastensis voucher RC L12 #1 mitochondrion, complete genome",Mammalia,15448,False,False,True,False,False
770,NC_004919,"Procavia capensis mitochondrion, complete genome",Mammalia,16743,False,False,True,False,False
771,NC_023210,"Mustela kathiah voucher YP6126 mitochondrion, complete genome",Mammalia,16552,False,False,True,False,False
772,NC_057516,"Didelphis aurita mitochondrion, complete genome",Mammalia,17165,False,False,True,False,False
773,NC_034735,"Lepilemur tymerlachsoni isolate LOKO4.2 mitochondrion, complete genome",Mammalia,16780,False,False,True,False,False
774,CM021961,"Callithrix jacchus isolate mCalJac1 mitochondrion, complete sequence, whole genome shotgun sequence",Mammalia,16489,False,True,True,True,False
775,NC_035554,"Microcebus arnholdi isolate AMB5.41 mitochondrion, complete genome",Mammalia,16832,False,False,True,False,False
776,NC_010650,"Mus terricolor mitochondrion, complete genome",Mammalia,16310,False,False,True,False,False
777,NC_019799,"Aotus lemurinus mitochondrion, complete genome",Mammalia,16580,False,False,True,False,False
778,CM003245,"Homo sapiens isolate CHM13 mitochondrion, complete sequence, whole genome shotgun sequence",Mammalia,16569,False,True,True,True,False
779,NC_012389,"Rattus exulans mitochondrion, complete genome",Mammalia,16307,False,False,True,False,False
780,NC_026442,"Dremomys rufigenis mitochondrion, complete genome",Mammalia,16545,False,False,True,False,False
781,NC_028307,"Felis chaus isolate FCH mitochondrion, complete genome",Mammalia,16653,False,False,True,False,False
782,NC_020697,"Hexaprotodon liberiensis isolate CYTO mitochondrion, complete genome",Mammalia,16396,False,False,True,False,False
783,NC_013276,"Mesocricetus auratus mitochondrion, complete genome",Mammalia,16264,False,False,True,False,False
784,NC_021946,"Chiropotes albinasus mitochondrion, complete genome",Mammalia,16706,False,False,True,False,False
785,NC_012774,"Carlito syrichta mitochondrion, complete genome",Mammalia,17004,False,False,True,False,False
786,NC_012102,"Lama glama mitochondrion, complete genome",Mammalia,16597,False,False,True,False,False
787,NC_002626,"Chalinolobus tuberculatus mitochondrion, complete genome",Mammalia,16818,False,False,True,False,False
788,NC_008216,"Nasalis larvatus mitochondrion, complete genome",Mammalia,16570,False,False,True,False,False
789,NC_020685,"Cephalophus adersi isolate SUN mitochondrion, complete genome",Mammalia,16435,False,False,True,False,False
790,NC_061980,"Rhinolophus paradoxolophus voucher 25003 mitochondrion, complete genome",Mammalia,16811,False,False,True,False,False
791,NC_060870,"Chodsigoa hypsibia mitochondrion, complete genome",Mammalia,16738,False,False,True,False,False
792,NC_001645,"Gorilla gorilla mitochondrion, complete genome",Mammalia,16364,False,False,True,False,False
793,NC_053801,"Arvicanthis somalicus voucher USB_ETH1068 mitochondrion, complete genome",Mammalia,16272,False,False,True,False,False
794,NC_001321,"Balaenoptera physalus mitochondrion, complete genome",Mammalia,16398,False,False,True,False,False
795,NC_021967,"Cacajao calvus mitochondrion, complete genome",Mammalia,16702,False,False,True,False,False
796,NC_036319,"Myotis yumanensis mitochondrion, complete genome",Mammalia,17268,False,False,True,False,False
797,LR862378,"Pipistrellus pipistrellus genome assembly, organelle: mitochondrion",Mammalia,16925,False,False,False,False,False
798,NC_034727,"Lepilemur septentrionalis isolate FARY5.1 mitochondrion, complete genome",Mammalia,16935,False,False,True,False,False
799,NC_006925,"Mystacina tuberculata mitochondrion, complete genome",Mammalia,16784,False,False,True,False,False
800,NC_011116,"Arctodus simus mitochondrion, complete genome",Mammalia,16754,False,False,True,False,False
801,NC_036725,"Halmaheramys bokimekot voucher 33262_WD225 mitochondrion, complete genome",Mammalia,16291,False,False,True,False,False
802,NC_037139,"Glyphonycteris daviesi voucher Royal Ontario Museum ROM-41125 mitochondrion, complete genome",Mammalia,16655,False,False,True,False,False
803,NC_002503,"Physeter catodon mitochondrion, complete genome",Mammalia,16428,False,False,True,False,False
804,NC_046915,"Megaerops niphanae isolate NLN25 mitochondrion, complete genome",Mammalia,16604,False,False,True,False,False
805,NC_035810,"Lutra sumatrana isolate 49 mitochondrion, complete genome",Mammalia,16586,False,False,True,False,False
806,NC_036064,"Manis gigantea mitochondrion, complete genome",Mammalia,16540,False,False,True,False,False
807,NC_041145,"Blarinella wardi mitochondrion, complete genome",Mammalia,16951,False,False,True,False,False
808,NC_022424,"Lophostoma silvicolum mitochondrion, complete genome",Mammalia,16666,False,False,True,False,False
809,NC_020667,"Simias concolor mitochondrion, complete genome",Mammalia,16561,False,False,True,False,False
810,NC_050018,"Sciurus granatensis voucher AMNH71613 mitochondrion, complete genome",Mammalia,16515,False,False,True,False,False
811,NC_021952,"Leontopithecus rosalia mitochondrion, complete genome",Mammalia,16872,False,False,True,False,False
812,NC_002811,"Tarsius bancanus mitochondrion, complete genome",Mammalia,16927,False,False,True,False,False
813,NC_035594,"Neotoma mexicana mitochondrion, complete genome",Mammalia,16653,False,False,True,False,False
814,NC_005315,"Nannospalax ehrenbergi mitochondrion, complete genome",Mammalia,16408,False,False,True,False,False
815,NC_057103,"Ochotona hyperborea mitochondrion, complete genome",Mammalia,17063,False,False,True,False,False
816,NC_049032,"Sundasciurus altitudinis voucher FMNH212978M mitochondrion, complete genome",Mammalia,16308,False,False,True,False,False
817,NC_020704,"Gazella cuvieri isolate CYTO mitochondrion, complete genome",Mammalia,16427,False,False,True,False,False
818,NC_031210,"Callospermophilus lateralis mitochondrion, complete genome",Mammalia,16457,False,False,True,False,False
819,NC_020792,"Tympanoctomys barrerae voucher AK13811 mitochondrion, complete genome",Mammalia,16863,False,False,True,False,False
820,NC_028575,"Tolypeutes matacus voucher ISEM_T-2348 mitochondrion, complete genome",Mammalia,16980,False,False,True,False,False
821,NC_000884,"Cavia porcellus mitochondrion, complete genome",Mammalia,16801,False,False,True,False,False
822,NC_026460,"Rhinolophus macrotis voucher Gz-07-64 mitochondrion, complete genome",Mammalia,16848,False,False,True,False,False
823,NC_049120,"Heimyscus fumosus voucher MNHN2001076 mitochondrion, complete genome",Mammalia,16246,False,False,True,False,False
824,NC_025330,"Cricetulus longicaudatus mitochondrion, complete genome",Mammalia,16302,False,False,True,False,False
825,NC_061262,"Rhinolophus philippinensis voucher CSOMA151 mitochondrion, complete genome",Mammalia,16817,False,False,True,False,False
826,NC_059784,"Spermophilus citellus mitochondrion, complete genome",Mammalia,16447,False,False,True,False,False
827,NC_009685,"Gulo gulo mitochondrion, complete genome",Mammalia,16541,False,False,True,False,False
828,NC_046909,"Epomophorus minor voucher FMNH-171299 mitochondrion, complete genome",Mammalia,16849,False,False,True,False,False
829,NC_014044,"Bison bonasus mitochondrion, complete genome",Mammalia,16326,False,False,True,False,False
830,NC_002504,"Vicugna pacos mitochondrion, complete genome",Mammalia,16652,False,False,True,False,False
831,NC_060611,"Stenella clymene isolate SRR16086849 mitochondrion, complete genome",Mammalia,16384,False,False,True,False,False
832,NC_028303,"Pardofelis marmorata isolate PMA mitochondrion, complete genome",Mammalia,16827,False,False,True,False,False
833,NC_035557,"Microcebus myoxinus isolate BEMA7.11 mitochondrion, complete genome",Mammalia,16842,False,False,True,False,False
834,NC_014703,"Cervus elaphus songaricus mitochondrion, complete genome",Mammalia,16419,False,False,True,False,False
835,NC_018096,"Saimiri boliviensis boliviensis mitochondrion, complete genome",Mammalia,16473,False,False,True,False,False
836,NC_020696,"Cephalorhynchus heavisidii isolate SUN mitochondrion, complete genome",Mammalia,16371,False,False,True,False,False
837,NC_006835,"Herpestes javanicus mitochondrion, complete genome",Mammalia,16763,False,False,True,False,False
838,NC_056331,"Cricetulus sokolovi mitochondrion, complete genome",Mammalia,16292,False,False,True,False,False
839,NC_053956,"Salanoia concolor mitochondrion, complete genome",Mammalia,16798,False,False,True,False,False
840,NC_020730,"Okapia johnstoni isolate CYTO mitochondrion, complete genome",Mammalia,16422,False,False,True,False,False
841,NC_005434,"Rhinolophus pumilus mitochondrion, complete genome",Mammalia,16869,False,False,True,False,False
842,NC_021956,"Mandrillus sphinx mitochondrion, complete genome",Mammalia,16546,False,False,True,False,False
843,NC_024558,"Vespertilio sinensis mitochondrion, complete genome",Mammalia,16971,False,False,True,False,False
844,NC_042218,"Mesoplodon bidens mitochondrion, complete genome",Mammalia,16347,False,False,True,False,False
845,NC_035812,"Sundasciurus brookei isolate 6 mitochondrion, complete genome",Mammalia,16418,False,False,True,False,False
846,NC_050029,"Hadrosciurus spadiceus voucher AMNH272825 mitochondrion, complete genome",Mammalia,16515,False,False,True,False,False
847,NC_022426,"Rhinophylla pumilio mitochondrion, complete genome",Mammalia,16671,False,False,True,False,False
848,NC_020432,"Equus grevyi mitochondrion, complete genome",Mammalia,16403,False,False,True,False,False
849,NC_011118,"Ursus thibetanus thibetanus mitochondrion, complete genome",Mammalia,17034,False,False,True,False,False
850,NC_050383,"Elaphodus cephalophus cephalophus mitochondrion, complete genome",Mammalia,16351,False,False,True,False,False
851,NC_006524,"Potorous tridactylus mitochondrion, complete genome",Mammalia,16922,False,False,True,False,False
852,NC_020017,"Moschus anhuiensis mitochondrion, complete genome",Mammalia,16351,False,False,True,False,False
853,NC_032375,"Tamias striatus isolate Tstri.#2 mitochondrion, complete genome",Mammalia,16553,False,False,True,False,False
854,NC_039548,"Proechimys pattoni isolate MNFS1292 voucher INPA:2559 mitochondrion, complete genome",Mammalia,16814,False,False,True,False,False
855,NC_034348,"Indopacetus pacificus voucher NMNS011169 mitochondrion, complete genome",Mammalia,16341,False,False,True,False,False
856,NC_028013,"Mustela eversmannii mitochondrion, complete genome",Mammalia,16463,False,False,True,False,False
857,NC_042217,"Mesoplodon mirus mitochondrion, complete genome",Mammalia,16342,False,False,True,False,False
858,NC_053898,"Gymnobelideus leadbeateri isolate B50252 mitochondrion, complete genome",Mammalia,16812,False,False,True,False,False
859,NC_037878,"Leontopithecus chrysopygus mitochondrion, complete genome",Mammalia,16618,False,False,True,False,False
860,NC_053960,"Eupleres goudotii mitochondrion, complete genome",Mammalia,16984,False,False,True,False,False
861,NC_008427,"Cystophora cristata mitochondrion, complete genome",Mammalia,16952,False,False,True,False,False
862,NC_053816,"Micaelamys namaquensis voucher USB_MOZ055 mitochondrion, complete genome",Mammalia,16236,False,False,True,False,False
863,NC_053969,"Arctictis binturong mitochondrion, complete genome",Mammalia,16506,False,False,True,False,False
864,NC_005826,"Dromiciops gliroides mitochondrion, complete genome",Mammalia,15350,False,False,True,False,False
865,NC_053807,"Stochomys longicaudatus voucher MNHN-ZM-2013-1388 mitochondrion, complete genome",Mammalia,16266,False,False,True,False,False
866,NC_041303,"Kogia sima mitochondrion, complete genome",Mammalia,16403,False,False,True,False,False
867,NC_050013,"Sciurus colliaei voucher USNM96230 mitochondrion, complete genome",Mammalia,16519,False,False,True,False,False
868,NC_011944,"Thylacinus cynocephalus mitochondrion, complete genome",Mammalia,17411,False,False,True,False,False
