,accession,name,class,seq_len,is_mongrel,have_contig,complete,shotgun,chromosome
869,NC_027278,"Ictidomys tridecemlineatus mitochondrion, complete genome",Mammalia,16458,False,False,True,False,False
870,NC_008133,"Phascolarctos cinereus mitochondrion, complete genome",Mammalia,16357,False,False,True,False,False
871,NC_056111,"Myotis ricketti mitochondrion, complete genome",Mammalia,17098,False,False,True,False,False
872,CM023663,"Homo sapiens isolate EgyptRef1 mitochondrion, complete sequence, whole genome shotgun sequence",Mammalia,16561,False,True,True,True,False
873,NC_008462,"Cervus nippon taiouanus mitochondrion, complete genome",Mammalia,16436,False,False,True,False,False
874,NC_019583,"Trachypithecus johnii mitochondrion, complete genome",Mammalia,16544,False,False,True,False,False
875,NC_013836,"Cervus elaphus xanthopygus mitochondrion, complete genome",Mammalia,16416,False,False,True,False,False
876,NC_060500,"Niviventer andersoni mitochondrion, complete genome",Mammalia,16291,False,False,True,False,False
877,NC_029840,"Episoriculus macrurus mitochondrion, complete genome",Mammalia,16943,False,False,True,False,False
878,NC_037136,"Macrotus californicus voucher Museum of Southwestern Biology, MSB-140888 mitochondrion, complete genome",Mammalia,16691,False,False,True,False,False
879,NC_023244,"Uropsilus soricipes mitochondrion, complete genome",Mammalia,16575,False,False,True,False,False
880,NC_054268,"Gracilinanus agilis mitochondrion, complete genome",Mammalia,16336,False,False,True,False,False
881,NC_012681,"Coelodonta antiquitatis mitochondrion, complete genome",Mammalia,16436,False,False,True,False,False
882,NC_034313,"Dicrostonyx groenlandicus mitochondrion, complete genome",Mammalia,16341,False,False,True,False,False
883,NC_038159,"Parahyaena brunnea isolate BH_love mitochondrion, complete genome",Mammalia,17197,False,False,True,False,False
884,NC_020674,"Addax nasomaculatus isolate VZ mitochondrion, complete genome",Mammalia,16751,False,False,True,False,False
885,NC_037780,"Pattonomys punctatus voucher AMNH:29872 mitochondrion, complete genome",Mammalia,16549,False,False,True,False,False
886,NC_034729,"Lepilemur grewcocki isolate HIH7.4 mitochondrion, complete genome",Mammalia,17052,False,False,True,False,False
887,NC_025748,"Lepus tolai mitochondrion, complete genome",Mammalia,17472,False,False,True,False,False
888,CM020645,"Hylobates moloch isolate HMO894 mitochondrion, complete sequence, whole genome shotgun sequence",Mammalia,16501,False,True,True,True,False
889,NC_020692,"Cephalophus ogilbyi isolate CAR125 mitochondrion, complete genome",Mammalia,16426,False,False,True,False,False
890,NC_006927,"Megaptera novaeangliae mitochondrion, complete genome",Mammalia,16398,False,False,True,False,False
891,NC_021478,"Rhizomys pruinosus mitochondrion, complete genome",Mammalia,16575,False,False,True,False,False
892,NC_049042,"Rattus korinchi voucher RMNH:23151 mitochondrion, complete genome",Mammalia,16312,False,False,True,False,False
893,NC_053753,"Phocoenoides dalli isolate 1454242 mitochondrion, complete genome",Mammalia,16319,False,False,True,False,False
894,NC_049121,"Chiropodomys gliroides voucher CBGPR4959 mitochondrion, complete genome",Mammalia,16262,False,False,True,False,False
895,NC_056332,"Parascaptor leucura mitochondrion, complete genome",Mammalia,16875,False,False,True,False,False
896,NC_012684,"Dicerorhinus sumatrensis mitochondrion, complete genome",Mammalia,16466,False,False,True,False,False
897,CM022001,"Canis lupus familiaris isolate Mischka breed German Shepherd mitochondrion, complete sequence, whole genome shotgun sequence",Mammalia,16728,False,True,True,True,False
898,NC_020739,"Pudu mephistophiles isolate MRGPm2 mitochondrion, complete genome",Mammalia,16426,False,False,True,False,False
899,NC_009492,"Ailuropoda melanoleuca mitochondrion, complete genome",Mammalia,16805,False,False,True,False,False
900,NC_060485,"Uropsilus investigator mitochondrion, complete genome",Mammalia,16519,False,False,True,False,False
901,NC_018782,"Equus hemionus kulan isolate Ehemionus mitochondrion, complete genome",Mammalia,16381,False,False,True,False,False
902,NC_029403,"Paguma larvata mitochondrion, complete genome",Mammalia,16710,False,False,True,False,False
903,NC_037509,"Psammomys obesus mitochondrion, complete genome",Mammalia,16592,False,False,True,False,False
904,CM003277,"Homo sapiens isolate CHM1 mitochondrion, complete sequence, whole genome shotgun sequence",Mammalia,16568,False,True,True,True,False
905,NC_012706,"Bos javanicus mitochondrion, complete genome",Mammalia,16339,False,False,True,False,False
906,NC_053979,"Ictonyx striatus mitochondrion, complete genome",Mammalia,16541,False,False,True,False,False
907,CM004277,"Mus musculus strain C57BL/6NJ mitochondrion, complete sequence, whole genome shotgun sequence",Mammalia,16300,False,True,True,True,False
908,NC_050033,"Sciurus lis voucher USNM140867 mitochondrion, complete genome",Mammalia,16512,False,False,True,False,False
909,NC_039550,"Proechimys steerei voucher INPA:3832, MNFS-689 mitochondrion, complete genome",Mammalia,16727,False,False,True,False,False
910,NC_028536,"Rhinolophus rex mitochondrion, complete genome",Mammalia,16845,False,False,True,False,False
911,NC_006973,"Cervus nippon yesoensis mitochondrion, complete genome",Mammalia,16543,False,False,True,False,False
912,NC_056330,"Trachypithecus laotum isolate TLAO1 mitochondrion, complete genome",Mammalia,16547,False,False,True,False,False
913,CM039160,"Sapajus apella isolate Mango mitochondrion, complete sequence, whole genome shotgun sequence",Mammalia,16550,False,True,True,True,False
914,NC_022698,"Myotis ikonnikovi mitochondrion, complete genome",Mammalia,16584,False,False,True,False,False
915,NC_050034,"Sciurus griseus voucher MSB40646 mitochondrion, complete genome",Mammalia,16520,False,False,True,False,False
916,NC_014045,"Hylobates pileatus mitochondrion, complete genome",Mammalia,16502,False,False,True,False,False
917,NC_008135,"Petaurus breviceps mitochondrion, complete genome",Mammalia,16103,False,False,True,False,False
918,NC_061914,"Holochilus sciureus isolate MVZ:Mamm:190356 mitochondrion, complete genome",Mammalia,16358,False,False,True,False,False
919,NC_021951,"Lagothrix lagotricha mitochondrion, complete genome",Mammalia,16595,False,False,True,False,False
920,NC_030174,"Arctotherium sp. mitochondrion, complete genome",Mammalia,16532,False,False,True,False,False
921,NC_023211,"Saimiri oerstedii citrinellus mitochondrion, complete genome",Mammalia,16472,False,False,True,False,False
922,NC_020681,"Axis porcinus isolate CYTO mitochondrion, complete genome",Mammalia,16375,False,False,True,False,False
923,NC_015243,"Microtus fortis calamorum mitochondrion, complete genome",Mammalia,16310,False,False,True,False,False
924,NC_046930,"Scotonycteris bergmansi isolate 1337 mitochondrion, complete genome",Mammalia,16727,False,False,True,False,False
925,NC_046932,"Scotonycteris zenkeri voucher MNHN-ZM-2011-682 mitochondrion, complete genome",Mammalia,16731,False,False,True,False,False
926,NC_012095,"Sus scrofa domesticus mitochondrion, complete genome",Mammalia,16770,False,False,True,False,False
927,NC_039090,"Sus scrofa cristatus isolate ABT/SWFH/1 mitochondrion, complete genome",Mammalia,16738,False,False,True,False,False
928,NC_021129,"Eospalax cansus mitochondrion, complete genome",Mammalia,16354,False,False,True,False,False
929,NC_026063,"Ovis orientalis breed Asian mouflon mitochondrion, complete genome",Mammalia,16617,False,False,True,False,False
930,CM003572,"Homo sapiens isolate CHM1 mitochondrion, complete sequence, whole genome shotgun sequence",Mammalia,16569,False,True,True,True,False
931,NC_016662,"Apodemus chejuensis mitochondrion, complete genome",Mammalia,16261,False,False,True,False,False
932,NC_028310,"Felis silvestris isolate FSI mitochondrion, complete genome",Mammalia,16640,False,False,True,False,False
933,NC_011579,"Martes zibellina mitochondrion, complete genome",Mammalia,16523,False,False,True,False,False
934,NC_025746,"Akodon montensis mitochondrion, complete genome",Mammalia,16378,False,False,True,False,False
935,NC_050030,"Microsciurus flaviventer voucher AMNH272819 mitochondrion, complete genome",Mammalia,16521,False,False,True,False,False
936,NC_035603,"Microcebus margotmarshae isolate TAFO6.7 mitochondrion, complete genome",Mammalia,16821,False,False,True,False,False
937,NC_028320,"Leopardus geoffroyi isolate OGE mitochondrion, complete genome",Mammalia,16738,False,False,True,False,False
938,NC_035564,"Microcebus jollyae isolate KIAN3.2 mitochondrion, complete genome",Mammalia,16794,False,False,True,False,False
939,NC_019441,"Globicephala melas mitochondrion, complete genome",Mammalia,16390,False,False,True,False,False
940,HG998573,"Canis lupus genome assembly, organelle: mitochondrion",Mammalia,16690,False,False,False,False,False
941,NC_009849,"Camelus dromedarius mitochondrion, complete genome",Mammalia,16643,False,False,True,False,False
942,NC_031809,"Phodopus roborovskii mitochondrion, complete genome",Mammalia,16273,False,False,True,False,False
943,NC_008426,"Erignathus barbatus mitochondrion, complete genome",Mammalia,16705,False,False,True,False,False
944,NC_059783,"Eliomys quercinus mitochondrion, complete genome",Mammalia,16627,False,False,True,False,False
945,NC_025550,"Callosciurus erythraeus mitochondrion, complete genome",Mammalia,16550,False,False,True,False,False
946,NC_059325,"Lemur catta isolate mLemCat1 mitochondrion, complete genome",Mammalia,17086,False,True,True,False,False
947,NC_050028,"Hadrosciurus pyrrhinus voucher MPEG41755 mitochondrion, complete genome",Mammalia,16522,False,False,True,False,False
948,NC_020660,"Spalacopus cyanus voucher DG657 mitochondrion, complete genome",Mammalia,16830,False,False,True,False,False
949,NC_037137,"Noctilio leporinus voucher Institut des Sciences de l'Evolution de Montpellier, ISEM-V-1890, ISEM-T-4573 mitochondrion, complete genome",Mammalia,16659,False,False,True,False,False
950,NC_020698,"Connochaetes gnou isolate SUN61 mitochondrion, complete genome",Mammalia,16412,False,False,True,False,False
951,NC_020793,"Oryx beisa isolate AWWP mitochondrion, complete genome",Mammalia,16518,False,False,True,False,False
952,NC_005212,"Acinonyx jubatus mitochondrion, complete genome",Mammalia,17047,False,False,True,False,False
953,NC_039544,"Proechimys gardneri isolate JLP16085 voucher INPA:2565 mitochondrion, complete genome",Mammalia,16818,False,False,True,False,False
954,NC_020710,"Gazella subgutturosa isolate PhC1 mitochondrion, complete genome",Mammalia,16433,False,False,True,False,False
955,NC_009686,"Canis lupus lupus mitochondrion, complete genome",Mammalia,16757,False,False,True,False,False
956,NC_048987,"Eospalax smithii mitochondrion, complete genome",Mammalia,16350,False,False,True,False,False
957,NC_015828,"Myotis formosus mitochondrion, complete genome",Mammalia,17159,False,False,True,False,False
958,NC_033884,"Hoolock tianxing isolate NA1 mitochondrion, complete genome",Mammalia,16511,False,False,True,False,False
959,NC_014692,"Sus scrofa taiwanensis mitochondrion, complete genome",Mammalia,16480,False,False,True,False,False
960,NC_021386,"Chinchilla lanigera mitochondrion, complete genome",Mammalia,16580,False,False,True,False,False
961,NC_028566,"Dasypus kappleri voucher ISEM_T-3365 mitochondrion, complete genome",Mammalia,16636,False,False,True,False,False
962,NC_001644,"Pan paniscus mitochondrion, complete genome",Mammalia,16563,False,False,True,False,False
963,CM004187,"Mus musculus musculus strain PWK/PhJ mitochondrion, complete sequence, whole genome shotgun sequence",Mammalia,16301,False,True,True,True,False
964,NC_029346,"Myotis myotis mitochondrion, complete genome",Mammalia,17213,False,False,True,False,False
965,NC_011120,"Gorilla gorilla gorilla mitochondrion, complete genome",Mammalia,16412,False,False,True,False,False
966,NC_012769,"Eulemur fulvus mayottensis mitochondrion, complete genome",Mammalia,17118,False,False,True,False,False
967,NC_013751,"Naemorhedus caudatus mitochondrion, complete genome",Mammalia,16519,False,False,True,False,False
968,NC_020716,"Litocranius walleri isolate AWWP mitochondrion, complete genome",Mammalia,16438,False,False,True,False,False
969,NC_006915,"Mus musculus molossinus mitochondrion, complete genome",Mammalia,16300,False,False,True,False,False
970,NC_035811,"Lutrogale perspicillata isolate 21 mitochondrion, complete genome",Mammalia,16043,False,False,True,False,False
971,NC_062331,"Zalophus wollebaeki voucher NHMO:30317 mitochondrion, complete genome",Mammalia,16465,False,False,True,False,False
972,NC_013068,"Tscherskia triton mitochondrion, complete genome",Mammalia,16488,False,False,True,False,False
973,NC_026085,"Varecia variegata isolate ANOSIB7 mitochondrion, complete genome",Mammalia,17051,False,False,True,False,False
974,NC_020711,"Hippocamelus antisensis isolate MRGHa9 mitochondrion, complete genome",Mammalia,16410,False,False,True,False,False
975,NC_028558,"Cabassous tatouay voucher ZVC_M365 mitochondrion, complete genome",Mammalia,16638,False,False,True,False,False
976,NC_021939,"Aotus azarai mitochondrion, complete genome",Mammalia,16555,False,False,True,False,False
977,NC_002765,"Nycticebus coucang mitochondrion, complete genome",Mammalia,16764,False,False,True,False,False
978,NC_049033,"Sundasciurus robinsoni voucher ROM113055M mitochondrion, complete genome",Mammalia,16324,False,False,True,False,False
979,NC_025270,"Mus cookii isolate R5155 mitochondrion, complete genome",Mammalia,16307,False,False,True,False,False
980,NC_020745,"Rusa timorensis isolate CYTO mitochondrion, complete genome",Mammalia,16434,False,False,True,False,False
981,NC_023950,"Blarinella quadraticauda mitochondrion, complete genome",Mammalia,17014,False,False,True,False,False
982,NC_000889,"Hippopotamus amphibius mitochondrion, complete genome",Mammalia,16407,False,False,True,False,False
983,CM026447,"Rangifer tarandus granti isolate KJH-003 mitochondrion, complete sequence, whole genome shotgun sequence",Mammalia,16362,False,True,True,True,False
984,NC_028560,"Calyptophractus retusus voucher ZSM_T-Bret mitochondrion, complete genome",Mammalia,16231,False,False,True,False,False
985,NC_020686,"Cephalophus callipygus isolate GLC24 mitochondrion, complete genome",Mammalia,16427,False,False,True,False,False
986,NC_052688,"Soriculus nigrescens mitochondrion, complete genome",Mammalia,17284,False,False,True,False,False
987,NC_019584,"Apodemus draco mitochondrion, complete genome",Mammalia,16282,False,False,True,False,False
988,NC_010340,"Canis lupus chanco mitochondrion, complete genome",Mammalia,16774,False,False,True,False,False
989,NC_025296,"Viverricula indica mitochondrion, complete genome",Mammalia,16583,False,False,True,False,False
990,NC_020728,"Neotragus moschatus isolate SUN mitochondrion, complete genome",Mammalia,16399,False,False,True,False,False
991,NC_018788,"Sarcophilus harrisii mitochondrion, complete genome",Mammalia,17117,False,False,True,False,False
992,NC_050026,"Glaucomys volans voucher USNM569823 mitochondrion, complete genome",Mammalia,16535,False,False,True,False,False
993,NC_023459,"Vulpes zerda mitochondrion, complete genome",Mammalia,16683,False,False,True,False,False
994,NC_026204,"Crocidura attenuata mitochondrion, complete genome",Mammalia,17534,False,False,True,False,False
995,NC_012764,"Perodicticus potto mitochondrion, complete genome",Mammalia,16638,False,False,True,False,False
996,NC_024942,"Mustela nigripes mitochondrion, complete genome",Mammalia,16556,False,False,True,False,False
997,NC_023122,"Pteropus alecto mitochondrion, complete genome",Mammalia,16739,False,False,True,False,False
998,NC_041160,"Nyctalus plancyi mitochondrion, complete genome",Mammalia,17494,False,False,True,False,False
999,NC_034728,"Lepilemur mittermeieri isolate DVA8.2 mitochondrion, complete genome",Mammalia,17077,False,False,True,False,False
1000,NC_020683,"Capra caucasica isolate MA4105 mitochondrion, complete genome",Mammalia,16624,False,False,True,False,False
1001,NC_033883,"Hoolock leuconedys x Hoolock tianxing isolate DANDAN mitochondrion, complete genome",Mammalia,16514,True,False,True,False,False
1002,NC_036312,"Myotis dominicensis mitochondrion, complete genome",Mammalia,16999,False,False,True,False,False
1003,NC_036430,"Muntiacus putaoensis mitochondrion, complete genome",Mammalia,16349,False,False,True,False,False
1004,NC_025513,"Macaca fuscata mitochondrion, complete genome",Mammalia,16565,False,False,True,False,False
1005,CM038193,"Ceratotherium simum cottoni isolate KB9947 breed northern white rhinoceros mitochondrion, complete sequence, whole genome shotgun sequence",Mammalia,16715,False,True,True,True,False
1006,NC_005275,"Platanista minor mitochondrion, complete genome",Mammalia,16324,False,False,True,False,False
1007,NC_018535,"Eospalax rothschildi mitochondrion, complete genome",Mammalia,16377,False,False,True,False,False
1008,NC_025271,"Capreolus pygargus isolate Cp5 mitochondrion, complete genome",Mammalia,16357,False,False,True,False,False
1009,NC_039987,"Ochotona koslowi mitochondrion, complete genome",Mammalia,16909,False,False,True,False,False
1010,NC_031847,"Hylopetes alboniger mitochondrion, complete genome",Mammalia,16584,False,False,True,False,False
1011,NC_025327,"Sorex tundrensis mitochondrion, complete genome",Mammalia,17444,False,False,True,False,False
1012,NC_053977,"Potos flavus mitochondrion, complete genome",Mammalia,16581,False,False,True,False,False
1013,NC_022805,"Tursiops australis isolate SABD1 mitochondrion, complete genome",Mammalia,16388,False,False,True,False,False
1014,NC_056259,"Phalanger orientalis voucher WAM M35002 mitochondrion, complete genome",Mammalia,15860,False,False,True,False,False
1015,NC_035607,"Phaner electromontis isolate AMB5.37 mitochondrion, complete genome",Mammalia,16914,False,False,True,False,False
1016,LR822067,"Lutra lutra genome assembly, organelle: mitochondrion",Mammalia,16536,False,False,False,False,False
1017,NC_020476,"Equus zebra isolate H11 mitochondrion, complete genome",Mammalia,16405,False,False,True,False,False
1018,NC_027424,Macropus giganteus complete mitochondrial genome,Mammalia,16887,False,False,True,False,False
1019,NC_036724,"Bunomys penitus voucher MORT_SP mitochondrion, complete genome",Mammalia,16308,False,False,True,False,False
1020,NC_001601,"Balaenoptera musculus mitochondrion, complete genome",Mammalia,16402,False,False,True,False,False
1021,CM004214,"Mus musculus strain BALB/cJ mitochondrion, complete sequence, whole genome shotgun sequence",Mammalia,16300,False,True,True,True,False
1022,NC_012141,"Martes flavigula mitochondrion, complete genome",Mammalia,16549,False,False,True,False,False
1023,NC_020627,"Damaliscus pygargus mitochondrion, complete genome",Mammalia,16385,False,False,True,False,False
1024,NC_034276,"Chlorocebus aethiops x Chlorocebus pygerythrus isolate C2 mitochondrion, complete genome",Mammalia,16388,True,False,True,False,False
1025,NC_024172,"Chrysocyon brachyurus mitochondrion, complete genome",Mammalia,16760,False,False,True,False,False
1026,NC_049115,"Praomys rostratus voucher MNHN2001125 mitochondrion, complete genome",Mammalia,16246,False,False,True,False,False
1027,NC_028335,"Bandicota indica mitochondrion, complete genome",Mammalia,16326,False,False,True,False,False
1028,NC_001992,"Papio hamadryas mitochondrion, complete genome",Mammalia,16521,False,False,True,False,False
1029,NC_036729,"Sundamys annandalei voucher MZB 28969 mitochondrion, complete genome",Mammalia,16299,False,False,True,False,False
1030,NC_032370,"Tamias quadrivittatus isolate DZTM.87 voucher DMNS:Mamm:11085 mitochondrion, complete genome",Mammalia,16549,False,False,True,False,False
1031,NC_028559,"Cabassous unicinctus voucher ISEM_T-2291 mitochondrion, complete genome",Mammalia,16397,False,False,True,False,False
1032,NC_057515,"Didelphis albiventris mitochondrion, complete genome",Mammalia,17341,False,False,True,False,False
1033,NC_057635,"Macroderma gigas mitochondrion, complete genome",Mammalia,16661,False,False,True,False,False
1034,NC_020750,"Tragelaphus oryx isolate PHC13 mitochondrion, complete genome",Mammalia,16397,False,False,True,False,False
1035,NC_034307,"Dicrostonyx hudsonius mitochondrion, complete genome",Mammalia,16338,False,False,True,False,False
1036,NC_020614,"Boselaphus tragocamelus mitochondrion, complete genome",Mammalia,16322,False,False,True,False,False
1037,NC_022429,"Vampyrum spectrum mitochondrion, complete genome",Mammalia,16637,False,False,True,False,False
1038,AP023485,"Homo sapiens mitochondiral DNA, complete genome",Mammalia,16568,False,False,True,False,False
1039,NC_012098,"Antilope cervicapra mitochondrion, complete genome",Mammalia,16431,False,False,True,False,False
1040,NC_002369,"Sciurus vulgaris mitochondrion, complete genome",Mammalia,16507,False,False,True,False,False
1041,NC_031156,"Macaca leucogenys mitochondrion, complete genome",Mammalia,16565,False,False,True,False,False
1042,NC_020433,"Equus kiang mitochondrion, complete genome",Mammalia,16380,False,False,True,False,False
1043,CM015301,"Myodes glareolus isolate 2016_BV1 mitochondrion, complete sequence, whole genome shotgun sequence",Mammalia,16354,False,True,True,True,False
1044,NC_004563,"Muntiacus muntjak mitochondrion, complete genome",Mammalia,16354,False,False,True,False,False
1045,NC_038064,"Tragelaphus buxtoni mitochondrion, complete genome",Mammalia,16601,False,False,True,False,False
1046,NC_026875,"Tamiops swinhoei mitochondrion, complete genome",Mammalia,16513,False,False,True,False,False
1047,NC_020724,"Nanger dama isolate CYTO mitochondrion, complete genome",Mammalia,16377,False,False,True,False,False
1048,NC_021961,"Cebus xanthosternos mitochondrion, complete genome",Mammalia,16527,False,False,True,False,False
1049,NC_032373,"Tamias dorsalis isolate DZTM.236 voucher DMNS:Mamm:11121 mitochondrion, complete genome",Mammalia,16549,False,False,True,False,False
1050,NC_002631,"Echinops telfairi mitochondrion, complete genome",Mammalia,16549,False,False,True,False,False
1051,NC_009629,"Camelus ferus mitochondrion, complete genome",Mammalia,16680,False,False,True,False,False
1052,NC_043895,"Arctictis binturong albifrons mitochondrion, complete genome",Mammalia,16642,False,False,True,False,False
1053,NC_020751,"Tragelaphus scriptus isolate PhC17 mitochondrion, complete genome",Mammalia,16402,False,False,True,False,False
1054,NC_029191,"Pipistrellus coromandra mitochondrion, complete genome",Mammalia,17153,False,False,True,False,False
1055,NC_023964,"Cercocebus torquatus mitochondrion, complete genome",Mammalia,16542,False,False,True,False,False
1056,NC_009126,"Procyon lotor mitochondrion, complete genome",Mammalia,16623,False,False,True,False,False
1057,NC_059928,"Microtus montebelli voucher HUA1900522 mitochondrion, complete genome",Mammalia,16307,False,False,True,False,False
1058,NC_053802,"Arvicanthis rufinus mitochondrion, complete genome",Mammalia,16262,False,False,True,False,False
1059,CM004181,"Mus musculus castaneus strain CAST/EiJ mitochondrion, complete sequence, whole genome shotgun sequence",Mammalia,16299,False,True,True,True,False
1060,NC_039717,"Macropus fuliginosus mitochondrion, complete genome",Mammalia,16881,False,False,True,False,False
1061,NC_032376,"Tamias umbrinus isolate DZTM.563 voucher DMNS:Mamm:11625 mitochondrion, complete genome",Mammalia,16552,False,False,True,False,False
1062,NC_001794,"Macropus robustus mitochondrion, complete genome",Mammalia,16896,False,False,True,False,False
1063,NC_061537,"Balionycteris maculata voucher MZF1954 mitochondrion, complete genome",Mammalia,16687,False,False,True,False,False
1064,NC_037782,"Toromys albiventris mitochondrion, complete genome",Mammalia,16656,False,False,True,False,False
1065,NC_024529,"Trachypithecus pileatus mitochondrion, complete genome",Mammalia,16526,False,False,True,False,False
1066,NC_046920,"Myonycteris leptodon isolate G0944 mitochondrion, complete genome",Mammalia,16493,False,False,True,False,False
1067,NC_039104,"Rhizomys sumatrensis mitochondrion, complete genome",Mammalia,16672,False,False,True,False,False
1068,NC_026706,"Cynomys ludovicianus mitochondrion, complete genome",Mammalia,16466,False,False,True,False,False
1069,NC_053257,"Talpa aquitania mitochondrion, complete genome",Mammalia,16826,False,False,True,False,False
1070,NC_042943,"Myotragus balearicus voucher ACAD13062 mitochondrion, complete genome",Mammalia,16637,False,False,True,False,False
1071,NC_014042,"Hylobates agilis mitochondrion, complete genome",Mammalia,16500,False,False,True,False,False
1072,NC_008215,"Semnopithecus entellus mitochondrion, complete genome",Mammalia,16532,False,False,True,False,False
1073,NC_008156,"Galemys pyrenaicus mitochondrion, complete genome",Mammalia,16510,False,False,True,False,False
1074,CM004186,"Mus musculus strain NZO/HiLtJ mitochondrion, complete sequence, whole genome shotgun sequence",Mammalia,16302,False,True,True,True,False
1075,NC_021948,"Eulemur rufus mitochondrion, complete genome",Mammalia,16280,False,False,True,False,False
1076,NC_046912,"Epomops franqueti isolate 1427 mitochondrion, complete genome",Mammalia,16686,False,False,True,False,False
1077,CM017348,"Lynx canadensis isolate LIC74 mitochondrion, complete sequence, whole genome shotgun sequence",Mammalia,17044,False,True,True,True,False
1078,NC_016920,"Muntiacus vuquangensis mitochondrion, complete genome",Mammalia,16361,False,False,True,False,False
1079,NC_005089,"Mus musculus mitochondrion, complete genome",Mammalia,16299,False,False,True,False,False
1080,NC_037466,"Macaca mulatta vestita mitochondrion, complete genome",Mammalia,16565,False,False,True,False,False
1081,NC_009510,"Ammotragus lervia mitochondrion, complete genome",Mammalia,16530,False,False,True,False,False
1082,NC_025670,"Leopoldamys edwardsi mitochondrion, complete genome",Mammalia,16284,False,False,True,False,False
