,accession,name,class,seq_len,is_mongrel,have_contig,complete,shotgun,chromosome
434,NC_030184,"Laonastes aenigmamus isolate LSP_S01 mitochondrion, complete genome",Mammalia,16364,False,False,True,False,False
435,NC_015484,"Plecotus auritus mitochondrion, complete genome",Mammalia,16900,False,False,True,False,False
436,NC_050021,"Microsciurus otinus voucher USNM499515 mitochondrion, complete genome",Mammalia,16516,False,False,True,False,False
437,NC_053958,"Galidia elegans mitochondrion, complete genome",Mammalia,16636,False,False,True,False,False
438,NC_025747,"Wiedomys cerradensis mitochondrion, complete genome",Mammalia,16346,False,False,True,False,False
439,NC_059785,"Urocitellus parryii mitochondrion, complete genome",Mammalia,16460,False,False,True,False,False
440,NC_036727,"Sundamys maxi voucher RMNH 21479 mitochondrion, complete genome",Mammalia,16303,False,False,True,False,False
441,NC_008431,"Pusa caspica mitochondrion, complete genome",Mammalia,16737,False,False,True,False,False
442,NC_039547,"Proechimys mincae voucher MCZ:11049 mitochondrion, complete genome",Mammalia,16626,False,False,True,False,False
443,NC_020677,"Alces alces isolate Kazakhstan mitochondrion, complete genome",Mammalia,16417,False,False,True,False,False
444,NC_039670,"Neotoma magister mitochondrion, complete genome",Mammalia,16310,False,False,True,False,False
445,CM004189,"Mus musculus domesticus strain WSB/EiJ mitochondrion, complete sequence, whole genome shotgun sequence",Mammalia,16301,False,True,True,True,False
446,CM027365,"Potos flavus isolate SDZ_MTNT-JEM001 mitochondrion, complete sequence, whole genome shotgun sequence",Mammalia,16434,False,True,True,True,False
447,CM033468,"Dromiciops gliroides isolate mDroGli1 mitochondrion, complete sequence, whole genome shotgun sequence",Mammalia,17310,False,True,True,True,False
448,NC_045205,"Capricornis rubidus mitochondrion, complete genome",Mammalia,16524,False,False,True,False,False
449,NC_025277,"Tamias sibiricus mitochondrion, complete genome",Mammalia,16558,False,False,True,False,False
450,NC_051516,"Stenocephalemys sokolovi voucher JCU_ETH1273 mitochondrion, complete genome",Mammalia,16251,False,False,True,False,False
451,NC_050020,"Microsciurus mimulus voucher USNM113311 mitochondrion, complete genome",Mammalia,16504,False,False,True,False,False
452,NC_042596,"Conepatus chinga mitochondrion, complete genome",Mammalia,16513,False,False,True,False,False
453,NC_007630,"Dasyurus hallucatus mitochondrion, complete genome",Mammalia,17159,False,False,True,False,False
454,NC_050015,"Sciurus variegatoides voucher MSB248241 mitochondrion, complete genome",Mammalia,16521,False,False,True,False,False
455,NC_029760,"Onychomys leucogaster mitochondrion, complete genome",Mammalia,16370,False,False,True,False,False
456,NC_028565,"Dasypus hybridus voucher ZVC_M2010 mitochondrion, complete genome",Mammalia,17013,False,False,True,False,False
457,NC_008219,"Piliocolobus badius mitochondrion, complete genome",Mammalia,16595,False,False,True,False,False
458,NC_031209,"Urocitellus richardsonii mitochondrion, complete genome",Mammalia,16460,False,False,True,False,False
459,NC_013993,"Homo sp. Altai mitochondrion, complete genome",Mammalia,16570,False,False,True,False,False
460,NC_036324,"Myotis atacamensis mitochondrion, complete genome",Mammalia,17100,False,False,True,False,False
461,CM034436,"Felis chaus isolate Fch-1a mitochondrion, complete sequence, whole genome shotgun sequence",Mammalia,17251,False,True,True,True,False
462,NC_008415,"Callorhinus ursinus mitochondrion, complete genome",Mammalia,16668,False,False,True,False,False
463,NC_039723,"Oligoryzomys stramineus voucher MW303 mitochondrion, complete genome",Mammalia,16314,False,False,True,False,False
464,NC_020645,"Arctonyx collaris voucher YP6001 mitochondrion, complete genome",Mammalia,16481,False,False,True,False,False
465,NC_020007,"Papio cynocephalus isolate north mitochondrion, complete genome",Mammalia,16515,False,False,True,False,False
466,CM010492,"Bos indicus x Bos taurus breed Angus x Brahman F1 hybrid mitochondrion, complete sequence, whole genome shotgun sequence",Mammalia,16339,True,True,True,True,False
467,NC_021944,"Cercopithecus albogularis mitochondrion, complete genome",Mammalia,16544,False,False,True,False,False
468,NC_020701,"Dorcatragus megalotis isolate AWWP mitochondrion, complete genome",Mammalia,16378,False,False,True,False,False
469,NC_046916,"Megaloglossus azagnyi isolate G0970 mitochondrion, complete genome",Mammalia,16538,False,False,True,False,False
470,CM004188,"Mus spretus strain SPRET/EiJ mitochondrion, complete sequence, whole genome shotgun sequence",Mammalia,16303,False,True,True,True,False
471,NC_006518,"Tarsipes rostratus mitochondrion, complete genome",Mammalia,15744,False,False,True,False,False
472,NC_021953,"Lepilemur ruficaudatus mitochondrion, complete genome",Mammalia,16936,False,False,True,False,False
473,NC_020788,"Tetracerus quadricornis mitochondrion, complete genome",Mammalia,16343,False,False,True,False,False
474,NC_053750,"Phocoena spinipinnis isolate 1092 mitochondrion, complete genome",Mammalia,16319,False,False,True,False,False
475,NC_025269,"Mus cervicolor isolate R4864 mitochondrion, complete genome",Mammalia,16304,False,False,True,False,False
476,NC_027658,"Callithrix kuhlii mitochondrion, complete genome",Mammalia,16500,False,False,True,False,False
477,NC_057272,"Blarinella griselda mitochondrion, complete genome",Mammalia,16947,False,False,True,False,False
478,NC_030342,"Mus famulus mitochondrion, complete genome",Mammalia,16291,False,False,True,False,False
479,NC_020646,"Taxidea taxus voucher ROM111450 mitochondrion, complete genome",Mammalia,16425,False,False,True,False,False
480,NC_028318,"Leopardus wiedii isolate LWI mitochondrion, complete genome",Mammalia,16704,False,False,True,False,False
481,NC_023961,"Cercopithecus mitis mitochondrion, complete genome",Mammalia,16512,False,False,True,False,False
482,NC_020687,"Cephalophus dorsalis isolate CAR35 mitochondrion, complete genome",Mammalia,16434,False,False,True,False,False
483,NC_057520,"Lutreolina crassicaudata mitochondrion, complete genome",Mammalia,17265,False,False,True,False,False
484,NC_053981,"Mellivora capensis mitochondrion, complete genome",Mammalia,16579,False,False,True,False,False
485,NC_013840,"Cervus elaphus yarkandensis mitochondrion, complete genome",Mammalia,16351,False,False,True,False,False
486,NC_012682,"Diceros bicornis mitochondrion, complete genome",Mammalia,16411,False,False,True,False,False
487,NC_035230,"Elephas antiquus isolate NEPEC mitochondrion, complete genome",Mammalia,16105,False,False,True,False,False
488,NC_039419,"Proechimys hoplomyoides voucher ROM-114848 mitochondrion, complete genome",Mammalia,16648,False,False,True,False,False
489,NC_039409,"Proechimys echinothrix isolate MCA5 voucher INPA-5379 mitochondrion, complete genome",Mammalia,16756,False,False,True,False,False
490,NC_018603,"Kobus leche mitochondrion, complete genome",Mammalia,16426,False,False,True,False,False
491,NC_032372,"Tamias canipes isolate DZTM.156 voucher DMNS:Mamm:11091 mitochondrion, complete genome",Mammalia,16552,False,False,True,False,False
492,NC_008424,"Leptonychotes weddellii mitochondrion, complete genome",Mammalia,16603,False,False,True,False,False
493,NC_018781,"Equus burchellii chapmani isolate 6381 mitochondrion, complete genome",Mammalia,16407,False,False,True,False,False
494,NC_053961,"Cryptoprocta ferox mitochondrion, complete genome",Mammalia,16862,False,False,True,False,False
495,NC_035563,"Microcebus mittermeieri isolate JAR1 mitochondrion, complete genome",Mammalia,16687,False,False,True,False,False
496,NC_037853,"Gorilla beringei isolate MG_08 mitochondrion, complete genome",Mammalia,15448,False,False,True,False,False
497,NC_012461,"Rattus praetor mitochondrion, complete genome",Mammalia,16293,False,False,True,False,False
498,NC_001913,"Oryctolagus cuniculus mitochondrion, complete genome",Mammalia,17245,False,False,True,False,False
499,NC_021954,"Lophocebus aterrimus mitochondrion, complete genome",Mammalia,16563,False,False,True,False,False
500,NC_007629,"Lipotes vexillifer mitochondrion, complete genome",Mammalia,16392,False,False,True,False,False
501,NC_046933,"Sphaerias blanfordi isolate LNK94 mitochondrion, complete genome",Mammalia,16776,False,False,True,False,False
502,NC_050995,"Lasionycteris noctivagans isolate lano1 mitochondrion, complete genome",Mammalia,16175,False,False,True,False,False
503,NC_036316,"Myotis oxyotus mitochondrion, complete genome",Mammalia,17067,False,False,True,False,False
504,NC_039431,"Ovis nivicola lydekkeri mitochondrion, complete genome",Mammalia,16471,False,False,True,False,False
505,NC_047188,"Peromyscus eremicus isolate FCR176_MZFC mitochondrion, complete genome",Mammalia,15988,False,False,True,False,False
506,NC_039369,"Proechimys guairae voucher FMNH:18688 mitochondrion, complete genome",Mammalia,16614,False,False,True,False,False
507,NC_018063,"Pygathrix cinerea 2 RL-2012 mitochondrion, complete genome",Mammalia,16535,False,False,True,False,False
508,NC_048991,"Dremomys everetti voucher MTRH141/BOR259 mitochondrion, complete genome",Mammalia,16178,False,False,True,False,False
509,NC_027115,"Catopuma temminckii mitochondrion, complete genome",Mammalia,16985,False,False,True,False,False
510,NC_045217,"Murexia melanurus mitochondrion, complete genome",Mammalia,17736,False,False,True,False,False
511,NC_014855,"Rattus leucopus mitochondrion, complete genome",Mammalia,16297,False,False,True,False,False
512,NC_030330,"Eothenomys miletus mitochondrion, complete genome",Mammalia,16344,False,False,True,False,False
513,NC_020766,"Ozotoceros bezoarticus isolate MRGOb2 mitochondrion, complete genome",Mammalia,16357,False,False,True,False,False
514,NC_020756,"Spalax carmeli mitochondrion, complete genome",Mammalia,16408,False,False,True,False,False
515,NC_021959,"Prolemur simus mitochondrion, complete genome",Mammalia,16765,False,False,True,False,False
516,CM021592,"Homo sapiens isolate NA24385 mitochondrion, complete sequence, whole genome shotgun sequence",Mammalia,16570,False,True,True,True,False
517,NC_015247,"Odocoileus virginianus mitochondrion, complete genome",Mammalia,16477,False,False,True,False,False
518,NC_027964,"Choloepus hoffmanni mitochondrion, complete genome",Mammalia,16466,False,False,True,False,False
519,NC_035815,"Callosciurus notatus isolate 3 mitochondrion, complete genome",Mammalia,16599,False,False,True,False,False
520,NC_020736,"Philantomba monticola isolate E11-14 mitochondrion, complete genome",Mammalia,16451,False,False,True,False,False
521,NC_053806,"Hybomys univittatus voucher MNHN-ZM-2017-1907 mitochondrion, complete genome",Mammalia,16250,False,False,True,False,False
522,NC_028315,"Leopardus pardalis isolate LPA mitochondrion, complete genome",Mammalia,16712,False,False,True,False,False
523,NC_028308,"Felis margarita isolate FMA mitochondrion, complete genome",Mammalia,16864,False,False,True,False,False
524,NC_062362,"Hippotragus niger niger haplogroup Southern 1 mitochondrion, complete genome",Mammalia,16506,False,False,True,False,False
525,NC_003040,"Episoriculus fumidus mitochondrion, complete genome",Mammalia,17488,False,False,True,False,False
526,NC_028321,"Leopardus guigna isolate OGU mitochondrion, complete genome",Mammalia,16773,False,False,True,False,False
527,NC_042604,"Moschus leucogaster mitochondrion, complete genome",Mammalia,16431,False,False,True,False,False
528,NC_046021,"Rhinolophus pusillus mitochondrion, complete genome",Mammalia,16833,False,False,True,False,False
529,NC_037134,"Hsunycteris thomasi voucher Institut des Sciences de l'Evolution de Montpellier, ISEM-V-1646, ISEM-T-3845 mitochondrion, complete genome",Mammalia,16661,False,False,True,False,False
530,NC_008420,"Arctocephalus townsendi mitochondrion, complete genome",Mammalia,16571,False,False,True,False,False
531,NC_046919,"Myonycteris angolensis isolate G0935 mitochondrion, complete genome",Mammalia,16566,False,False,True,False,False
532,NC_035656,"Mirza coquereli isolate ZOMB53 mitochondrion, complete genome",Mammalia,17066,False,False,True,False,False
533,NC_035800,"Mammut americanum mitochondrion, complete genome",Mammalia,16467,False,False,True,False,False
534,NC_061567,"Kerivoula papillosa voucher MZF1961 mitochondrion, complete genome",Mammalia,16671,False,False,True,False,False
535,NC_049117,"Mus baoulei voucher MNHN-ZM-2010-74 mitochondrion, complete genome",Mammalia,16299,False,False,True,False,False
536,NC_008428,"Phoca fasciata mitochondrion, complete genome",Mammalia,16694,False,False,True,False,False
537,NC_017599,"Apodemus chevrieri mitochondrion, complete genome",Mammalia,16298,False,False,True,False,False
538,NC_019802,"Theropithecus gelada mitochondrion, complete genome",Mammalia,16546,False,False,True,False,False
539,NC_035819,"Leopoldamys sabanus isolate 14 mitochondrion, complete genome",Mammalia,15975,False,False,True,False,False
540,NC_008419,"Neophoca cinerea mitochondrion, complete genome",Mammalia,16736,False,False,True,False,False
541,NC_004069,"Muntiacus reevesi mitochondrion, complete genome",Mammalia,16354,False,False,True,False,False
542,NC_031802,"Cricetulus migratorius mitochondrion, complete genome",Mammalia,16246,False,False,True,False,False
543,NC_024030,"Equus przewalskii mitochondrial DNA, complete genome, isolate: NOUMA1",Mammalia,16592,False,False,True,False,False
544,NC_011949,"Myrmecobius fasciatus mitochondrion, complete genome",Mammalia,16813,False,False,True,False,False
545,NC_041486,"Elephantulus edwardii mitochondrion, complete genome",Mammalia,16552,False,False,True,False,False
546,NC_039444,"Proechimys simonsi voucher FMNH:41462 mitochondrion, complete genome",Mammalia,16754,False,False,True,False,False
547,NC_056333,"Episoriculus leucops mitochondrion, complete genome",Mammalia,16838,False,False,True,False,False
548,NC_046901,"Casinycteris ophiodon voucher ZMB-5001 mitochondrion, complete genome",Mammalia,16477,False,False,True,False,False
549,NC_026095,"Indri indri isolate TANDRA4.18 mitochondrion, complete genome",Mammalia,17098,False,False,True,False,False
550,NC_020717,"Madoqua kirkii isolate SUN mitochondrion, complete genome",Mammalia,16468,False,False,True,False,False
551,NC_037527,"Bradypus tridactylus voucher ISEM_T-5013 mitochondrion, complete genome",Mammalia,16920,False,False,True,False,False
552,NC_041638,"Myotis frater mitochondrion, complete genome",Mammalia,17089,False,False,True,False,False
553,NC_046899,"Casinycteris argynnis isolate 2209 mitochondrion, complete genome",Mammalia,16661,False,False,True,False,False
554,NC_053973,"Galictis vittata mitochondrion, complete genome",Mammalia,16495,False,False,True,False,False
555,NC_020647,"Nasua nasua voucher ROM108237 mitochondrion, complete genome",Mammalia,16388,False,False,True,False,False
556,NC_013069,"Budorcas taxicolor mitochondrion, complete genome",Mammalia,16667,False,False,True,False,False
557,NC_020010,"Papio ursinus isolate north mitochondrion, complete genome",Mammalia,16496,False,False,True,False,False
558,NC_021751,"Mustela altaica mitochondrion, complete genome",Mammalia,16521,False,False,True,False,False
559,NC_003428,"Ursus maritimus mitochondrion, complete genome",Mammalia,17017,False,False,True,False,False
560,NC_005035,"Mogera wogura mitochondrion, complete genome",Mammalia,16814,False,False,True,False,False
561,NC_011112,"Ursus spelaeus mitochondrion, complete genome",Mammalia,16780,False,False,True,False,False
562,NC_012057,"Sousa chinensis mitochondrion, complete genome",Mammalia,16388,False,False,True,False,False
563,NC_010640,"Capricornis swinhoei mitochondrion, complete genome",Mammalia,16524,False,False,True,False,False
564,NC_027248,"Crocidura mindorus voucher FMNH221890 mitochondrion, complete genome",Mammalia,15458,False,False,True,False,False
565,NC_018540,"Hipposideros armiger mitochondrion, complete genome",Mammalia,16784,False,False,True,False,False
566,NC_029422,"Myotis muricola mitochondrion, complete genome",Mammalia,17224,False,False,True,False,False
567,NC_039099,"Proechimys cuvieri isolate FMNH19503 mitochondrion, complete genome",Mammalia,16776,False,False,True,False,False
568,NC_014864,"Rattus villosissimus mitochondrion, complete genome",Mammalia,16303,False,False,True,False,False
569,NC_020708,"Gazella leptoceros isolate CYTO mitochondrion, complete genome",Mammalia,16439,False,False,True,False,False
570,NC_060652,"Canis lupus signatus isolate Cl-H119 mitochondrion, complete genome",Mammalia,16728,False,False,True,False,False
571,NC_053972,"Galerella sanguinea mitochondrion, complete genome",Mammalia,16646,False,False,True,False,False
572,NC_042734,"Blarina brevicauda voucher nopiming mitochondrion, complete genome",Mammalia,16919,False,False,True,False,False
573,NC_061979,"Rhinolophus marshalli voucher GX07039 mitochondrion, complete genome",Mammalia,16844,False,False,True,False,False
574,NC_036369,"Otocyon megalotis mitochondrion, complete genome",Mammalia,16431,False,False,True,False,False
575,NC_028309,"Felis nigripes isolate FNI mitochondrion, complete genome",Mammalia,16723,False,False,True,False,False
576,NC_035558,"Microcebus griseorufus isolate BEZ7.11 mitochondrion, complete genome",Mammalia,16719,False,False,True,False,False
577,NC_009691,"Ailurus fulgens styani mitochondrion, complete genome",Mammalia,16374,False,False,True,False,False
578,NC_035561,"Microcebus sambiranensis isolate GAR6 mitochondrion, complete genome",Mammalia,16674,False,False,True,False,False
579,NC_027945,"Microtus ochrogaster mitochondrion, complete genome",Mammalia,16292,False,False,True,False,False
580,CM004276,"Mus musculus strain LP/J mitochondrion, complete sequence, whole genome shotgun sequence",Mammalia,16301,False,True,True,True,False
581,NC_023795,"Macaca assamensis mitochondrion, complete genome",Mammalia,16542,False,False,True,False,False
582,NC_021942,"Callithrix pygmaea mitochondrion, complete genome",Mammalia,16520,False,False,True,False,False
583,NC_024538,"Myodes glareolus mitochondrion, complete genome",Mammalia,16353,False,False,True,False,False
584,NC_036415,"Delphinus delphis isolate BS_08 mitochondrion, complete genome",Mammalia,16384,False,False,True,False,False
585,NC_028302,"Panthera leo isolate PLE mitochondrion, complete genome",Mammalia,16620,False,False,True,False,False
586,NC_046913,"Hypsignathus monstrosus isolate 1699 mitochondrion, complete genome",Mammalia,16738,False,False,True,False,False
587,NC_012061,"Delphinus capensis mitochondrion, complete genome",Mammalia,16385,False,False,True,False,False
588,NC_056388,"Dinaromys bogdanovi voucher 1093 mitochondrion, complete genome",Mammalia,16356,False,False,True,False,False
589,NC_027935,"Vulpes ferrilata mitochondrion, complete genome",Mammalia,16667,False,False,True,False,False
590,NC_014047,"Symphalangus syndactylus mitochondrion, complete genome",Mammalia,16516,False,False,True,False,False
591,NC_037180,"Peromyscus leucopus strain GS16A1 stock mitochondrion, complete genome",Mammalia,16326,False,False,True,False,False
592,NC_035613,"Peromyscus megalops mitochondrion, complete genome",Mammalia,16821,False,False,True,False,False
593,NC_008417,"Arctocephalus pusillus mitochondrion, complete genome",Mammalia,16652,False,False,True,False,False
594,NC_029477,"Myodes rufocanus mitochondrion, complete genome",Mammalia,16487,False,False,True,False,False
595,NC_002078,"Orycteropus afer mitochondrion, complete genome",Mammalia,16816,False,False,True,False,False
596,NC_012670,"Macaca fascicularis mitochondrion, complete genome",Mammalia,16575,False,False,True,False,False
597,NC_008136,"Lagorchestes hirsutus mitochondrion, complete genome",Mammalia,16889,False,False,True,False,False
598,NC_008830,"Phacochoerus africanus mitochondrion, complete genome",Mammalia,16719,False,False,True,False,False
599,NC_019588,"Feresa attenuata mitochondrion, complete genome",Mammalia,16387,False,False,True,False,False
600,NC_009628,"Camelus bactrianus mitochondrion, complete genome",Mammalia,16659,False,False,True,False,False
601,NC_007704,"Cervus elaphus mitochondrion, complete genome",Mammalia,16357,False,False,True,False,False
602,NC_012100,"Giraffa camelopardalis angolensis mitochondrion, complete genome",Mammalia,16433,False,False,True,False,False
603,NC_026090,"Palaeopropithecus ingens mitochondrion, complete genome",Mammalia,16910,False,False,True,False,False
604,NC_023963,"Cercopithecus diana mitochondrion, complete genome",Mammalia,16505,False,False,True,False,False
605,NC_061568,"Hipposideros cervinus voucher MZF1964 mitochondrion, complete genome",Mammalia,16648,False,False,True,False,False
606,NC_008753,"Ursus thibetanus mupinensis mitochondrion, complete genome",Mammalia,16868,False,False,True,False,False
607,NC_028554,"Bradypus pygmaeus voucher USNM_579179 mitochondrion, complete genome",Mammalia,16799,False,False,True,False,False
608,NC_012775,"Saimiri sciureus mitochondrion, complete genome",Mammalia,16474,False,False,True,False,False
609,NC_015112,"Heterocephalus glaber mitochondrion, complete genome",Mammalia,16386,False,False,True,False,False
610,NC_019591,"Orcaella heinsohni mitochondrion, complete genome",Mammalia,16389,False,False,True,False,False
611,NC_016871,"Artibeus lituratus mitochondrion, complete genome",Mammalia,16709,False,False,True,False,False
612,NC_010638,"Uncia uncia mitochondrion, complete genome",Mammalia,16773,False,False,True,False,False
613,NC_024041,"Lepus townsendii haplotype tow mitochondrion, complete genome",Mammalia,17732,False,False,True,False,False
614,NC_011304,"Rhinolophus formosae mitochondrion, complete genome",Mammalia,16915,False,False,True,False,False
615,NC_006380,"Bos grunniens mitochondrion, complete genome",Mammalia,16323,False,False,True,False,False
616,NC_008418,"Phocarctos hookeri mitochondrion, complete genome",Mammalia,16722,False,False,True,False,False
617,NC_034739,"Lepilemur microdon isolate RANO234 mitochondrion, complete genome",Mammalia,17050,False,False,True,False,False
618,NC_039103,"Proechimys semispinosus isolate MCZ10828 mitochondrion, complete genome",Mammalia,16826,False,False,True,False,False
619,NC_044972,"Monachus monachus isolate MS2 mitochondrion, complete genome",Mammalia,16739,False,False,True,False,False
620,NC_034718,"Lepilemur fleuretae isolate AND6.3 mitochondrion, complete genome",Mammalia,16879,False,False,True,False,False
621,NC_027243,"Crocidura palawanensis voucher FMNH195992 mitochondrion, complete genome",Mammalia,15458,False,False,True,False,False
622,NC_023965,"Allenopithecus nigroviridis mitochondrion, complete genome",Mammalia,16517,False,False,True,False,False
623,NC_061963,"Hipposideros pomona mitochondrion, complete genome",Mammalia,16798,False,False,True,False,False
624,NC_037135,"Lonchorhina aurita voucher Museum of Vertebrate Zoology at Berkeley, MVZ-185587 mitochondrion, complete genome",Mammalia,16661,False,False,True,False,False
625,NC_028571,"Euphractus sexcinctus voucher ISEM_T-1246 mitochondrion, complete genome",Mammalia,16602,False,False,True,False,False
626,NC_046900,"Casinycteris campomaanensis voucher MNHN-ZM-2011-637 mitochondrion, complete genome",Mammalia,16630,False,False,True,False,False
627,NC_035309,"Hippotragus leucophaeus mitochondrion, complete genome",Mammalia,16505,False,False,True,False,False
628,NC_023958,"Vulpes corsac mitochondrion, complete genome",Mammalia,16721,False,False,True,False,False
629,NC_009748,"Chlorocebus tantalus mitochondrion, complete genome",Mammalia,16368,False,False,True,False,False
630,NC_021940,"Avahi laniger mitochondrion, complete genome",Mammalia,16787,False,False,True,False,False
631,NC_045900,"Suricata suricatta mitochondrion, complete genome",Mammalia,16914,False,False,True,False,False
632,NC_003033,"Ochotona collaris mitochondrion, complete genome",Mammalia,16968,False,False,True,False,False
633,NC_037186,"Ochotona erythrotis mitochondrion, complete genome",Mammalia,16663,False,False,True,False,False
634,NC_026088,"Megaladapis edwardsi mitochondrion, complete genome",Mammalia,16781,False,False,True,False,False
635,NC_018539,"Rhinolophus luctus mitochondrion, complete genome",Mammalia,16775,False,False,True,False,False
636,NC_011053,"Propithecus coquereli mitochondrion, complete genome",Mammalia,17104,False,False,True,False,False
637,NC_042761,"Steno bredanensis voucher CRI008296 mitochondrion, complete genome",Mammalia,16386,False,False,True,False,False
638,NC_018598,"Uropsilus sp. 1 FT-2014 mitochondrion, complete genome",Mammalia,16530,False,False,True,False,False
639,NC_027683,"Meriones libycus mitochondrion, complete genome",Mammalia,16341,False,False,True,False,False
640,NC_005271,"Balaenoptera acutorostrata mitochondrion, complete genome",Mammalia,16417,False,False,True,False,False
641,NC_034733,"Lepilemur ahmansoni isolate KIBO22 mitochondrion, complete genome",Mammalia,17179,False,False,True,False,False
642,NC_021957,"Nomascus leucogenys mitochondrion, complete genome",Mammalia,16478,False,False,True,False,False
643,NC_006930,"Eubalaena australis mitochondrion, complete genome",Mammalia,16385,False,False,True,False,False
644,NC_008491,"Muntiacus reevesi micrurus mitochondrion, complete genome",Mammalia,16353,False,False,True,False,False
645,NC_020720,"Mazama gouazoupira isolate MRGsp2 mitochondrion, complete genome",Mammalia,16355,False,False,True,False,False
646,CM004255,"Mus musculus strain C3H/HeJ mitochondrion, complete sequence, whole genome shotgun sequence",Mammalia,16301,False,True,True,True,False
647,NC_053814,"Thallomys paedulcus voucher TM41047 mitochondrion, complete genome",Mammalia,16280,False,False,True,False,False
648,NC_020705,"Gazella dorcas isolate AWWP mitochondrion, complete genome",Mammalia,16432,False,False,True,False,False
649,CM033226,"Cervus canadensis isolate Bull #8, Minnesota mitochondrion, complete sequence, whole genome shotgun sequence",Mammalia,16429,False,True,True,True,False
